project_name,category,priority,preparing_start,preparing_end,execution_end,progress_percent,description,team_lead
Phoenix Security Platform,Security,Critical,2025-06-02,2025-06-12,2025-07-05,85,Advanced threat detection and response system,Sarah Chen
Cloud Migration Initiative,Infrastructure,High,2025-06-05,2025-06-15,2025-07-08,72,Migrate legacy systems to cloud infrastructure,Michael Rodriguez
Customer Portal Redesign,Development,Medium,2025-06-08,2025-06-18,2025-07-11,90,Complete overhaul of customer-facing portal,Emily Johnson
GDPR Compliance Update,Compliance,Critical,2025-06-10,2025-06-17,2025-07-10,45,Update data handling procedures for GDPR,David Kim
AI Chatbot Implementation,Development,High,2025-06-12,2025-06-22,2025-07-15,60,Deploy intelligent customer service chatbot,Lisa Zhang
Network Security Audit,Security,High,2025-06-15,2025-06-25,2025-07-18,30,Comprehensive network vulnerability assessment,James Wilson
Database Optimization,Infrastructure,Medium,2025-06-18,2025-06-28,2025-07-21,88,Improve database performance and scaling,Anna Kowalski
Mobile App Development,Development,High,2025-06-20,2025-06-30,2025-07-23,15,Native mobile application for iOS and Android,Carlos Martinez
Payment Gateway Integration,Development,Critical,2025-06-22,2025-07-02,2025-07-25,95,Secure payment processing system integration,Sophie Turner
API Documentation Update,Documentation,Low,2025-06-25,2025-07-05,2025-07-28,70,Comprehensive API documentation overhaul,Ryan O'Connor
Backup System Upgrade,Infrastructure,Medium,2025-06-28,2025-07-08,2025-08-01,55,Enhanced automated backup and recovery system,Maria Gonzalez
User Authentication Revamp,Security,High,2025-07-01,2025-07-11,2025-08-04,40,Multi-factor authentication implementation,Alex Thompson
Content Management System,Development,Medium,2025-07-03,2025-07-13,2025-08-06,25,Custom CMS for marketing team,Jennifer Lee
SOC 2 Compliance Audit,Compliance,Critical,2025-07-05,2025-07-15,2025-08-08,80,Security controls audit and certification,Robert Davis
Load Balancer Configuration,Infrastructure,Medium,2025-07-08,2025-07-18,2025-08-11,65,High-availability load balancing setup,Nina Petrov
E-commerce Platform,Development,High,2025-07-10,2025-07-20,2025-08-13,10,Full-featured online shopping platform,Thomas Anderson
Disaster Recovery Plan,Infrastructure,Critical,2025-07-12,2025-07-22,2025-08-15,35,Comprehensive disaster recovery procedures,Rachel Green
Analytics Dashboard,Analytics,Medium,2025-07-15,2025-07-25,2025-08-18,75,Real-time business intelligence dashboard,Kevin Park
Identity Management System,Security,High,2025-07-18,2025-07-28,2025-08-21,50,Centralized identity and access management,Laura Smith
Container Orchestration,Infrastructure,Medium,2025-07-20,2025-07-30,2025-08-23,20,Kubernetes cluster deployment and management,Peter Müller
Quality Assurance Framework,Testing,High,2025-07-22,2025-08-01,2025-08-25,90,Automated testing and QA processes,Samantha Wu
Customer Data Platform,Analytics,Critical,2025-07-25,2025-08-04,2025-08-28,60,Unified customer data management system,Daniel Foster
Microservices Architecture,Development,High,2025-07-28,2025-08-07,2025-08-31,30,Migration to microservices architecture,Isabella Garcia
Monitoring and Alerting,Operations,Medium,2025-08-01,2025-08-11,2025-09-04,85,Comprehensive system monitoring solution,Christopher Lee
DevOps Pipeline Enhancement,Operations,High,2025-08-05,2025-08-15,2025-09-08,45,CI/CD pipeline optimization and automation,Amanda Johnson
Security Information System,Security,Critical,2025-08-08,2025-08-18,2025-09-11,70,SIEM implementation for threat monitoring,Marcus Brown
Blockchain Integration,Development,Medium,2025-08-12,2025-08-22,2025-09-15,15,Blockchain technology proof of concept,Natalie Taylor
Performance Testing Suite,Testing,High,2025-08-15,2025-08-25,2025-09-18,55,Comprehensive performance and load testing,Andrew Wilson
Data Warehouse Migration,Analytics,Medium,2025-08-18,2025-08-28,2025-09-21,40,Modern data warehouse infrastructure,Victoria Chen
Legacy System Modernization,Infrastructure,Critical,2025-08-22,2025-09-01,2025-09-25,25,Modernize critical legacy applications,Benjamin Clark