project_name,category,priority,preparing_start,preparing_end,execution_end,progress_percent,description,team_lead
Project Alpha Security Enhancement,Security,Critical,2025-07-15,2025-07-22,2025-08-05,75,Implement new multi-factor authentication system,John Smith
Project Beta Database Migration,Infrastructure,High,2025-07-18,2025-07-28,2025-08-15,45,Database migration and performance optimization,Jane Doe
Project Gamma Frontend Redesign,Development,High,2025-07-20,2025-07-27,2025-08-12,90,Complete frontend redesign and UX improvements,Mike Johnson
Project Delta GDPR Compliance,Compliance,Critical,2025-07-22,2025-08-01,2025-08-20,30,GDPR compliance implementation and audit,Sarah Wilson
Project Epsilon AI Research,Research,Medium,2025-07-25,2025-08-03,2025-08-25,15,AI integration feasibility study and prototyping,David Brown
Project Zeta Cloud Migration,Infrastructure,High,2025-07-28,2025-08-06,2025-08-28,65,Complete cloud infrastructure migration,Lisa Chen
Project Eta Mobile App Development,Development,Medium,2025-08-01,2025-08-08,2025-08-30,55,Native mobile application development,Robert Taylor
Project Theta API Gateway Implementation,Development,High,2025-08-03,2025-08-11,2025-09-05,80,Implement unified API gateway architecture,Emma Davis
Project Iota Data Analytics Platform,Analytics,Medium,2025-08-05,2025-08-14,2025-09-10,25,Build comprehensive data analytics platform,Alex Martinez
Project Kappa Cybersecurity Audit,Security,Critical,2025-08-08,2025-08-15,2025-09-12,40,Complete cybersecurity audit and remediation,Jennifer Lee
Project Lambda Performance Optimization,Infrastructure,High,2025-08-10,2025-08-18,2025-09-15,70,System performance optimization and tuning,Mark Anderson
Project Mu User Training Program,Training,Low,2025-08-12,2025-08-21,2025-09-18,20,Comprehensive user training program development,Carol White
Project Nu Backup System Upgrade,Infrastructure,Medium,2025-08-15,2025-08-23,2025-09-20,85,Backup and disaster recovery system upgrade,Kevin Rodriguez
Project Xi Integration Testing,Testing,High,2025-08-18,2025-08-26,2025-09-22,60,Comprehensive integration testing framework,Michelle Brown
Project Omicron Documentation Update,Documentation,Low,2025-08-20,2025-08-28,2025-09-25,25,Update all technical documentation and guides,Thomas Garcia
Project Pi Quality Assurance,Testing,Medium,2025-08-22,2025-08-31,2025-09-28,95,Complete quality assurance testing suite,Rachel Kim
Project Rho Vendor Management,Operations,Low,2025-08-25,2025-09-03,2025-10-01,35,Vendor management system implementation,Steven Thompson
Project Sigma Monitoring System,Infrastructure,High,2025-08-28,2025-09-06,2025-10-05,50,Advanced monitoring and alerting system,Amanda Jackson
Project Tau DevOps Pipeline,Development,High,2025-09-01,2025-09-10,2025-10-08,75,CI/CD pipeline implementation and automation,Ryan Wilson
Project Upsilon Load Testing,Testing,Medium,2025-09-03,2025-09-12,2025-10-10,30,Comprehensive load testing and optimization,Nicole Harris